language	description	reference	emotions	elicitation	size
Russian	RUSLANA database	Makarova, 2002	Anger, fear, happiness, sadness, surprise, neutral	Recordings of actors expressing emotional sentences	61 actors (49 females, 12 males), 610 utterances.
Spanish	SES Spanish Emotional Speech database	Montero, 1999	Anger, happiness, sadness, surprise, neutral	Recordings of an actor reading neutral texts in different emotional states	three passages and 15 sentences acted by one speaker in four emotions plus neutral style.
Spanish	Emotional speech database	Iriondo, 2000	Desire, disgust, fear, fury, joy, sadness, surprise	Recordings of actors reading texts in different emotional states and intensities	eight actors (four females, four males), three intensities, 336 utterances.
Spanish	Emotional  speech  database	Álvarez Martínez, Barrientos Cruz, 2005	Anger, fear, happiness, sadness, neutral	Recordings of actors and actresses uttering sentences in different emotional states plus extracted utterances from DVD movies	380 utterances (300 utterances with four different sentences as synthetic data set (actors), 80 utterances as real data set (DVD movies)), 15 non-professional speakers (female and male) in the synthetic data set.
Swedish	Emotional speech database	Abelin, Allwood, 2000	Anger, disgust, dominance, fear, joy, sadness, shyness, surprise	Recordings of a speaker uttering a non-emotional phrase in different emotional states	1 male speaker.
Swedish	VeriVox database	Karlsson, 1999	Stress	Recordings of male speakers reading texts in different tasks and stress levels	50 males speakers, 30 min per speaker.
Swedish	The Voice Provider Material (VP)	Neiberg, 2006	Emphatic, negative, neutral	Recordings of voice-controlled telephone services (traffic information, postal assistance, etc.)	7619 utterances, thereof 160 emphatic, 335 negative and 7,124 neutral.
NONE	Corpus of infants’ cries	Matsunaga, 2006	Anger, sadness	Infants’ cries recorded by their mothers at home using a digital recorder, emotional judgment by the mothers taking into consideration facial expressions, behavior, etc., emotional intensity ranked from zero (emotion not contained at all) to four (emotion fully contained)	402 cries, 23 infants (12 females, 11 males, age: 8–13 months).